{
  "businessPartnerNumber" : "BPNL00000003AYRE",
  "enclosedSites" : [ {
    "areaOfApplication" : "Development, Marketing und Sales and also Procurement for interiour components",
    "enclosedSiteBPN" : "BPNS00000003AYRE"
  } ],
  "registrationNumber" : "12 198 54182 TMS",
  "uploader" : "BPNL00000003AYRE",
  "validator" : {
    "validatorName" : "Data Service Provider X",
    "validatorBPN" : "BPNL00000007YREZ"
  },
  "validUntil" : "2026-01-24",
  "documentID" : "DOC-UID-123456789",
  "validFrom" : "2023-01-25",
  "trustLevel" : "none",
  "type" : {
    "certificateVersion" : "2015",
    "certificateType" : "ISO9001"
  },
  "areaOfApplication" : "Development, Marketing und Sales and also Procurement for interiour components",
  "issuer" : "BPNL00000023ZAVC"
}